{
  "$schema": "https://json-schema.org/draft/2020-12/schema",
  "$id": "https://smt-line.local/contracts/v1/mqtt_buffers.schema.json",
  "title": "I3 smt/v1/<site>/<line>/buffers",
  "type": "object",
  "required": [
    "v",
    "msg_id",
    "run_id",
    "ts",
    "sim_time_s",
    "line",
    "levels",
    "capacity"
  ],
  "properties": {
    "v": {
      "const": 1
    },
    "msg_id": {
      "type": "string",
      "minLength": 1
    },
    "run_id": {
      "type": "string",
      "minLength": 1
    },
    "ts": {
      "type": "string",
      "pattern": "^\\d{4}-\\d{2}-\\d{2}T\\d{2}:\\d{2}:\\d{2}\\.\\d{3}Z$"
    },
    "sim_time_s": {
      "type": "number",
      "minimum": 0
    },
    "line": {
      "type": "string",
      "pattern": "^line[0-9]+$"
    },
    "levels": {
      "type": "object",
      "propertyNames": {
        "enum": [
          "buf_printer_spi",
          "buf_spi_pnp",
          "buf_pnp_reflow",
          "buf_reflow_aoi",
          "buf_aoi_ict"
        ]
      },
      "additionalProperties": {
        "type": "integer",
        "minimum": 0
      },
      "required": [
        "buf_printer_spi",
        "buf_spi_pnp",
        "buf_pnp_reflow",
        "buf_reflow_aoi",
        "buf_aoi_ict"
      ]
    },
    "capacity": {
      "type": "integer",
      "minimum": 1
    }
  }
}
